 57.880594 200.10.12.55 -> MIDIRECCIONIP TCP 66 44478 > http [SYN] Seq=0 Win=49640 Len=0 MSS=1460 WS=1 SACK_PERM=1
 57.880646 MIDIRECCIONIP -> 200.10.12.55 TCP 66 http > 44478 [SYN, ACK] Seq=0 Ack=1 Win=14600 Len=0 MSS=1460 SACK_PERM=1 WS=128
 58.012497 200.10.12.55 -> MIDIRECCIONIP TCP 54 44478 > http [ACK] Seq=1 Ack=1 Win=49640 Len=0
 58.017732 200.10.12.55 -> MIDIRECCIONIP TCP 1514 [TCP segment of a reassembled PDU]
 58.017769 MIDIRECCIONIP -> 200.10.12.55 TCP 54 http > 44478 [ACK] Seq=1 Ack=1461 Win=17536 Len=0
 58.017798 200.10.12.55 -> MIDIRECCIONIP HTTP 568 POST http://www.pandora.cl/cgi-bin/tbk_bp_resultado.cgi HTTP/1.1  (application/x-www-form-urlencoded)
 58.017809 MIDIRECCIONIP -> 200.10.12.55 TCP 54 http > 44478 [ACK] Seq=1 Ack=1975 Win=20480 Len=0
 59.146525 MIDIRECCIONIP -> 200.10.12.55 TCP 1310 [TCP segment of a reassembled PDU]
 59.147067 MIDIRECCIONIP -> 200.10.12.55 HTTP 59 HTTP/1.1 200 OK  (text/html)
 59.279550 200.10.12.55 -> MIDIRECCIONIP TCP 54 44478 > http [ACK] Seq=1975 Ack=1257 Win=49640 Len=0
 59.279583 200.10.12.55 -> MIDIRECCIONIP TCP 54 44478 > http [ACK] Seq=1975 Ack=1262 Win=49640 Len=0
 64.199323 MIDIRECCIONIP -> 200.10.12.55 TCP 54 http > 44478 [FIN, ACK] Seq=1262 Ack=1975 Win=20480 Len=0
 64.333729 200.10.12.55 -> MIDIRECCIONIP TCP 54 44478 > http [ACK] Seq=1975 Ack=1263 Win=49640 Len=0


Dirección Server de Certificación : 
* 200.10.12.55

Direcciones Server Producción : 
* 200.10.14.162
* 200.10.14.163
* 200.10.12.162
* 200.10.12.163
* 200.10.14.34
* 200.10.14.177
